ID,Bureaux,"Region, Pays",City delimitor position,Region delimitor pos,Region,Country,Address
520,"Thales near  Tirana,  Tirana,  Albania","Tirana,  Tirana,  Albania",7,16,"Tirana,  Tirana",Albania,
169,"Thales near  Algiers,  Algiers,  Algeria","Algiers,  Algiers,  Algeria",8,18,"Algiers,  Algiers",Algeria,
597,"Thales near  Oran,  Oran,  Algeria","Oran,  Oran,  Algeria",5,12,"Oran,  Oran",Algeria,
659,"Thales near  Luanda,  Luanda,  Angola","Luanda,  Luanda,  Angola",7,16,"Luanda,  Luanda",Angola,
615,"Thales near  Barracas,  Capital Federal,  Argentina","Barracas,  Capital Federal,  Argentina",9,27,"Barracas,  Capital Federal",Argentina,
623,"Thales near  Bs As,  Bs As,  Argentina","Bs As,  Bs As,  Argentina",6,14,"Bs As,  Bs As",Argentina,
173,"Thales near  Buenos Aires,  Buenos Aires,  Argentina","Buenos Aires,  Buenos Aires,  Argentina",13,28,"Buenos Aires,  Buenos Aires",Argentina,
621,"Thales near  Capital Federal,  Capital Federal,  Argentina","Capital Federal,  Capital Federal,  Argentina",16,34,"Capital Federal,  Capital Federal",Argentina,
617,"Thales near  Microcentro,  Capital Federal,  Argentina","Microcentro,  Capital Federal,  Argentina",12,30,"Microcentro,  Capital Federal",Argentina,
605,"Thales near  Palermo,  Capital Federal,  Argentina","Palermo,  Capital Federal,  Argentina",8,26,"Palermo,  Capital Federal",Argentina,
624,"Thales near  San  Isidro,  Bs As,  Argentina","San  Isidro,  Bs As,  Argentina",12,20,"San  Isidro,  Bs As",Argentina,
619,"Thales near  San Telmo,  Capital Federal,  Argentina","San Telmo,  Capital Federal,  Argentina",10,28,"San Telmo,  Capital Federal",Argentina,
544,"Thales near  Amberley ,  Queensland,  Australia","Amberley ,  Queensland,  Australia",10,23,"Amberley ,  Queensland",Australia,
545,"Thales near  Benalla,  Victoria,  Australia","Benalla,  Victoria,  Australia",8,19,"Benalla,  Victoria",Australia,
546,"Thales near  Bendigo ,  Victoria,  Australia","Bendigo ,  Victoria,  Australia",9,20,"Bendigo ,  Victoria",Australia,
547,"Thales near  Brisbane Airport   ,  Queensland,  Australia","Brisbane Airport   ,  Queensland,  Australia",20,33,"Brisbane Airport   ,  Queensland",Australia,
548,"Thales near  Campbell,  Australian Capital Territory,  Australia","Campbell,  Australian Capital Territory,  Australia",9,40,"Campbell,  Australian Capital Territory",Australia,
569,"Thales near  Carrington ,  New South Wales,  Australia","Carrington ,  New South Wales,  Australia",12,30,"Carrington ,  New South Wales",Australia,
553,"Thales near  Crib Point,  Victoria,  Australia","Crib Point,  Victoria,  Australia",11,22,"Crib Point,  Victoria",Australia,
549,"Thales near  Deakin ,  Australian Capital Territory,  Australia","Deakin ,  Australian Capital Territory,  Australia",8,39,"Deakin ,  Australian Capital Territory",Australia,
568,"Thales near  Denman ,  New South Wales,  Australia","Denman ,  New South Wales,  Australia",8,26,"Denman ,  New South Wales",Australia,
579,"Thales near  Douglas,  Queensland,  Australia","Douglas,  Queensland,  Australia",8,21,"Douglas,  Queensland",Australia,
555,"Thales near  Eden,  New South Wales,  Australia","Eden,  New South Wales,  Australia",5,23,"Eden,  New South Wales",Australia,
588,"Thales near  Edinburgh (AUS),  South Australia,  Australia","Edinburgh (AUS),  South Australia,  Australia",16,34,"Edinburgh (AUS),  South Australia",Australia,
556,"Thales near  Footscray ,  Victoria,  Australia","Footscray ,  Victoria,  Australia",11,22,"Footscray ,  Victoria",Australia,
550,"Thales near  Fyshwick,  Australian Capital Territory,  Australia","Fyshwick,  Australian Capital Territory,  Australia",9,40,"Fyshwick,  Australian Capital Territory",Australia,
489,"Thales near  Garden Island - NSW,  New South Wales,  Australia","Garden Island - NSW,  New South Wales,  Australia",20,38,"Garden Island - NSW,  New South Wales",Australia,
558,"Thales near  Garden Island - WA,  Western Australia,  Australia","Garden Island - WA,  Western Australia,  Australia",19,39,"Garden Island - WA,  Western Australia",Australia,
559,"Thales near  Glenbrook ,  New South Wales,  Australia","Glenbrook ,  New South Wales,  Australia",11,29,"Glenbrook ,  New South Wales",Australia,
560,"Thales near  Henderson ,  Western Australia,  Australia","Henderson ,  Western Australia,  Australia",11,31,"Henderson ,  Western Australia",Australia,
561,"Thales near  Holdsworthy ,  New South Wales,  Australia","Holdsworthy ,  New South Wales,  Australia",13,31,"Holdsworthy ,  New South Wales",Australia,
573,"Thales near  Lara ,  Victoria,  Australia","Lara ,  Victoria,  Australia",6,17,"Lara ,  Victoria",Australia,
563,"Thales near  Lithgow ,  New South Wales,  Australia","Lithgow ,  New South Wales,  Australia",9,27,"Lithgow ,  New South Wales",Australia,
564,"Thales near  Managalore ,  Victoria,  Australia","Managalore ,  Victoria,  Australia",12,23,"Managalore ,  Victoria",Australia,
565,"Thales near  Mascot ,  New South Wales,  Australia","Mascot ,  New South Wales,  Australia",8,26,"Mascot ,  New South Wales",Australia,
128,"Thales near  Melbourne,  Victoria,  Australia","Melbourne,  Victoria,  Australia",10,21,"Melbourne,  Victoria",Australia,
566,"Thales near  Moorebank ,  New South Wales,  Australia","Moorebank ,  New South Wales,  Australia",11,29,"Moorebank ,  New South Wales",Australia,
567,"Thales near  Mulwala ,  New South Wales,  Australia","Mulwala ,  New South Wales,  Australia",9,27,"Mulwala ,  New South Wales",Australia,
487,"Thales near  Nedlands,  Western Australia,  Australia","Nedlands,  Western Australia,  Australia",9,29,"Nedlands,  Western Australia",Australia,
570,"Thales near  North Ryde,  New South Wales,  Australia","North Ryde,  New South Wales,  Australia",11,29,"North Ryde,  New South Wales",Australia,
543,"Thales near  Nowra,  New South Wales,  Australia","Nowra,  New South Wales,  Australia",6,24,"Nowra,  New South Wales",Australia,
571,"Thales near  Oakey,  Queensland,  Australia","Oakey,  Queensland,  Australia",6,19,"Oakey,  Queensland",Australia,
572,"Thales near  Orchard Hills,  New South Wales,  Australia","Orchard Hills,  New South Wales,  Australia",14,32,"Orchard Hills,  New South Wales",Australia,
551,"Thales near  Pialligo,  Australian Capital Territory,  Australia","Pialligo,  Australian Capital Territory,  Australia",9,40,"Pialligo,  Australian Capital Territory",Australia,
574,"Thales near  Puckapunyal  ,  Victoria,  Australia","Puckapunyal  ,  Victoria,  Australia",14,25,"Puckapunyal  ,  Victoria",Australia,
575,"Thales near  Rockingham,  Western Australia,  Australia","Rockingham,  Western Australia,  Australia",11,31,"Rockingham,  Western Australia",Australia,
491,"Thales near  Rydalmere ,  New South Wales,  Australia","Rydalmere ,  New South Wales,  Australia",11,29,"Rydalmere ,  New South Wales",Australia,
576,"Thales near  Singleton,  New South Wales,  Australia","Singleton,  New South Wales,  Australia",10,28,"Singleton,  New South Wales",Australia,
557,"Thales near  South Arm ,  Tasmania,  Australia","South Arm ,  Tasmania,  Australia",11,22,"South Arm ,  Tasmania",Australia,
577,"Thales near  St Marys,  New South Wales,  Australia","St Marys,  New South Wales,  Australia",9,27,"St Marys,  New South Wales",Australia,
580,"Thales near  Townsville,  Queensland,  Australia","Townsville,  Queensland,  Australia",11,24,"Townsville,  Queensland",Australia,
552,"Thales near  Turner,  Australian Capital Territory,  Australia","Turner,  Australian Capital Territory,  Australia",7,38,"Turner,  Australian Capital Territory",Australia,
562,"Thales near  Wallangarra ,  Queensland,  Australia","Wallangarra ,  Queensland,  Australia",13,26,"Wallangarra ,  Queensland",Australia,
582,"Thales near  Williamtown,  New South Wales,  Australia","Williamtown,  New South Wales,  Australia",12,30,"Williamtown,  New South Wales",Australia,
554,"Thales near  Winnellie,  Northern Territory,  Australia","Winnellie,  Northern Territory,  Australia",10,31,"Winnellie,  Northern Territory",Australia,
581,"Thales near  Wollstonecraft,  New South Wales,  Australia","Wollstonecraft,  New South Wales,  Australia",15,33,"Wollstonecraft,  New South Wales",Australia,
480,"Thales near  Vienna,  Vienna,  Austria","Vienna,  Vienna,  Austria",7,16,"Vienna,  Vienna",Austria,
592,"Thales near  Antwerpen,  Vlanderen,  Belgium","Antwerpen,  Vlanderen,  Belgium",10,22,"Antwerpen,  Vlanderen",Belgium,
176,"Thales near  Brussels-Capital,  Brussels,  Belgium","Brussels-Capital,  Brussels,  Belgium",17,28,"Brussels-Capital,  Brussels",Belgium,
595,"Thales near  Charleroi,  Wallonie,  Belgium","Charleroi,  Wallonie,  Belgium",10,21,"Charleroi,  Wallonie",Belgium,
594,"Thales near  Herstal,  Wallonie,  Belgium","Herstal,  Wallonie,  Belgium",8,19,"Herstal,  Wallonie",Belgium,
593,"Thales near  Tubize,  Wallonie,  Belgium","Tubize,  Wallonie,  Belgium",7,18,"Tubize,  Wallonie",Belgium,
179,"Thales near  Rio de Janeiro,  Rio de Janeiro,  Brazil","Rio de Janeiro,  Rio de Janeiro,  Brazil",15,32,"Rio de Janeiro,  Rio de Janeiro",Brazil,
507,"Thales near  Sofia,  Sofia,  Bulgaria","Sofia,  Sofia,  Bulgaria",6,14,"Sofia,  Sofia",Bulgaria,
385,"Thales near  Burnaby,  British Columbia,  Canada","Burnaby,  British Columbia,  Canada",8,27,"Burnaby,  British Columbia",Canada,"4190 Still Creek Drive, Suite 250, Burnaby, British Columbia, Canada, V5C 6C6"
383,"Thales near  Halifax,  Nova Scotia,  Canada","Halifax,  Nova Scotia,  Canada",8,22,"Halifax,  Nova Scotia",Canada,
152,"Thales near  Montréal,  Québec,  Canada","Montréal,  Québec,  Canada",9,18,"Montréal,  Québec",Canada,"2800, Marie-Curie Avenue, Saint-Laurent, Quebec, Canada, H4S 2C2"
150,"Thales near  Ottawa,  Ontario,  Canada","Ottawa,  Ontario,  Canada",7,17,"Ottawa,  Ontario",Canada,"1 Chrysalis Way, Ottawa, Ontario, Canada, K2G 6P9"
151,"Thales near  Québec,  Québec,  Canada","Québec,  Québec,  Canada",7,16,"Québec,  Québec",Canada,
382,"Thales near  Quebec City,  Québec,  Canada","Quebec City,  Québec,  Canada",12,21,"Quebec City,  Québec",Canada,"1405 boulevard du Parc Technologique, Quebec, Quebec, Canada, G1P 4P5"
153,"Thales near  St Laurent,  Québec,  Canada","St Laurent,  Québec,  Canada",11,20,"St Laurent,  Québec",Canada,"4868 Levy Street, Saint-Laurent, Quebec, Canada, H4R 2P1"
384,"Thales near  Toronto,  Ontario,  Canada","Toronto,  Ontario,  Canada",8,18,"Toronto,  Ontario",Canada,"105 Moatfield Drive, Toronto, Ontario, Canada, M3B 0A4"
386,"Thales near  Val-Belair,  Québec,  Canada","Val-Belair,  Québec,  Canada",11,20,"Val-Belair,  Québec",Canada,
182,"Thales near  Santiago,  Metropolitan Region,  Chile","Santiago,  Metropolitan Region,  Chile",9,31,"Santiago,  Metropolitan Region",Chile,
185,"Thales near  Beijing,  Beijing,  China","Beijing,  Beijing,  China",8,18,"Beijing,  Beijing",China,
528,"Thales near  Hong Kong,  Hong Kong,  China","Hong Kong,  Hong Kong,  China",10,22,"Hong Kong,  Hong Kong",China,
530,"Thales near  Kowloon,  Hong Kong,  China","Kowloon,  Hong Kong,  China",8,20,"Kowloon,  Hong Kong",China,
533,"Thales near  Shangai,  Shangai,  China","Shangai,  Shangai,  China",8,18,"Shangai,  Shangai",China,
514,"Thales near  Zagreb,  Zagreb,  Croatia","Zagreb,  Zagreb,  Croatia",7,16,"Zagreb,  Zagreb",Croatia,
498,"Thales near  Prague,  Prague,  Czech Republic","Prague,  Prague,  Czech Republic",7,16,"Prague,  Prague",Czech Republic,
671,"Thales near  Copenhagen,  Hovedstaden,  Denmark","Copenhagen,  Hovedstaden,  Denmark",11,25,"Copenhagen,  Hovedstaden",Denmark,
473,"Thales near  Santo Domingo,  Santo Domingo,  Dominican Republic","Santo Domingo,  Santo Domingo,  Dominican Republic",14,30,"Santo Domingo,  Santo Domingo",Dominican Republic,
188,"Thales near  Cairo,  Lower-Egypt,  Egypt","Cairo,  Lower-Egypt,  Egypt",6,20,"Cairo,  Lower-Egypt",Egypt,
78,"Thales near  Aix,  PACA,  France","Aix,  PACA,  France",4,11,"Aix,  PACA",France,
40,"Thales near  Arcueil,  Région Parisienne,  France","Arcueil,  Région Parisienne,  France",8,28,"Arcueil,  Région Parisienne",France,
250,"Thales near  Aubagne,  PACA,  France","Aubagne,  PACA,  France",8,15,"Aubagne,  PACA",France,
41,"Thales near  Bagneux,  Région Parisienne,  France","Bagneux,  Région Parisienne,  France",8,28,"Bagneux,  Région Parisienne",France,
68,"Thales near  Blagnac,  Sud Ouest,  France","Blagnac,  Sud Ouest,  France",8,20,"Blagnac,  Sud Ouest",France,
69,"Thales near  Bordeaux,  Sud Ouest,  France","Bordeaux,  Sud Ouest,  France",9,21,"Bordeaux,  Sud Ouest",France,
29,"Thales near  Brest,  Bretagne,  France","Brest,  Bretagne,  France",6,17,"Brest,  Bretagne",France,
42,"Thales near  Brétigny sur Orge,  Région Parisienne,  France","Brétigny sur Orge,  Région Parisienne,  France",18,38,"Brétigny sur Orge,  Région Parisienne",France,
70,"Thales near  Brive la gaillarde,  Sud Ouest,  France","Brive la gaillarde,  Sud Ouest,  France",19,31,"Brive la gaillarde,  Sud Ouest",France,
248,"Thales near  Cannes,  PACA,  France","Cannes,  PACA,  France",7,14,"Cannes,  PACA",France,
30,"Thales near  Carquefou,  Pays de la Loire,  France","Carquefou,  Pays de la Loire,  France",10,29,"Carquefou,  Pays de la Loire",France,
43,"Thales near  Cergy Pontoise,  Région Parisienne,  France","Cergy Pontoise,  Région Parisienne,  France",15,35,"Cergy Pontoise,  Région Parisienne",France,
31,"Thales near  Cesson Sévigné,  Bretagne,  France","Cesson Sévigné,  Bretagne,  France",15,26,"Cesson Sévigné,  Bretagne",France,
32,"Thales near  Chateaubourg,  Bretagne,  France","Chateaubourg,  Bretagne,  France",13,24,"Chateaubourg,  Bretagne",France,
35,"Thales near  Châtellerault,  Centre,  France","Châtellerault,  Centre,  France",14,23,"Châtellerault,  Centre",France,
44,"Thales near  Chatou,  Région Parisienne,  France","Chatou,  Région Parisienne,  France",7,27,"Chatou,  Région Parisienne",France,
81,"Thales near  Cholet,  Pays de la Loire,  France","Cholet,  Pays de la Loire,  France",7,26,"Cholet,  Pays de la Loire",France,
45,"Thales near  Colombes,  Région Parisienne,  France","Colombes,  Région Parisienne,  France",9,29,"Colombes,  Région Parisienne",France,
46,"Thales near  Conflans Sainte Honorine,  Région Parisienne,  France","Conflans Sainte Honorine,  Région Parisienne,  France",25,45,"Conflans Sainte Honorine,  Région Parisienne",France,
47,"Thales near  Elancourt,  Région Parisienne,  France","Elancourt,  Région Parisienne,  France",10,30,"Elancourt,  Région Parisienne",France,
667,"Thales near  Etrelles,  Bretagne,  France","Etrelles,  Bretagne,  France",9,20,"Etrelles,  Bretagne",France,
36,"Thales near  Fleury-Orleans,  Centre,  France","Fleury-Orleans,  Centre,  France",15,24,"Fleury-Orleans,  Centre",France,
48,"Thales near  Fontenay aux roses,  Région Parisienne,  France","Fontenay aux roses,  Région Parisienne,  France",19,39,"Fontenay aux roses,  Région Parisienne",France,
73,"Thales near  Grenoble,  Rhône-Alpes,  France","Grenoble,  Rhône-Alpes,  France",9,23,"Grenoble,  Rhône-Alpes",France,
49,"Thales near  Guyancourt,  Région Parisienne,  France","Guyancourt,  Région Parisienne,  France",11,31,"Guyancourt,  Région Parisienne",France,
50,"Thales near  Issy les Moulineaux,  Région Parisienne,  France","Issy les Moulineaux,  Région Parisienne,  France",20,40,"Issy les Moulineaux,  Région Parisienne",France,
51,"Thales near  Jouy en Josas,  Région Parisienne,  France","Jouy en Josas,  Région Parisienne,  France",14,34,"Jouy en Josas,  Région Parisienne",France,
37,"Thales near  La Ferté Saint Aubin,  Centre,  France","La Ferté Saint Aubin,  Centre,  France",21,30,"La Ferté Saint Aubin,  Centre",France,
52,"Thales near  Lambersart,  France Nord,  France","Lambersart,  France Nord,  France",11,25,"Lambersart,  France Nord",France,
33,"Thales near  Laval,  Pays de la Loire,  France","Laval,  Pays de la Loire,  France",6,25,"Laval,  Pays de la Loire",France,
53,"Thales near  Lille,  France Nord,  France","Lille,  France Nord,  France",6,20,"Lille,  France Nord",France,
54,"Thales near  Limours,  Région Parisienne,  France","Limours,  Région Parisienne,  France",8,28,"Limours,  Région Parisienne",France,
74,"Thales near  Lyon,  Rhône-Alpes,  France","Lyon,  Rhône-Alpes,  France",5,19,"Lyon,  Rhône-Alpes",France,
675,"Thales near  Maison-Laffite,  Région Parisienne,  France","Maison-Laffite,  Région Parisienne,  France",15,35,"Maison-Laffite,  Région Parisienne",France,
55,"Thales near  Malakoff,  Région Parisienne,  France","Malakoff,  Région Parisienne,  France",9,29,"Malakoff,  Région Parisienne",France,
56,"Thales near  Massy,  Région Parisienne,  France","Massy,  Région Parisienne,  France",6,26,"Massy,  Région Parisienne",France,
57,"Thales near  Méru,  Région Parisienne,  France","Méru,  Région Parisienne,  France",5,25,"Méru,  Région Parisienne",France,
58,"Thales near  Meudon la Forêt,  Région Parisienne,  France","Meudon la Forêt,  Région Parisienne,  France",16,36,"Meudon la Forêt,  Région Parisienne",France,
75,"Thales near  Moirans,  Rhône-Alpes,  France","Moirans,  Rhône-Alpes,  France",8,22,"Moirans,  Rhône-Alpes",France,
124,"Thales near  Montpellier,  France Sud Est,  France","Montpellier,  France Sud Est,  France",12,29,"Montpellier,  France Sud Est",France,
59,"Thales near  Montrouge,  Région Parisienne,  France","Montrouge,  Région Parisienne,  France",10,30,"Montrouge,  Région Parisienne",France,
82,"Thales near  Nantes,  Pays de la Loire,  France","Nantes,  Pays de la Loire,  France",7,26,"Nantes,  Pays de la Loire",France,
60,"Thales near  Neuilly,  Région Parisienne,  France","Neuilly,  Région Parisienne,  France",8,28,"Neuilly,  Région Parisienne",France,"45 rue de Villiers, 92526 Neuilly-sur-Seine Cedex, France"
61,"Thales near  Orsay,  Région Parisienne,  France","Orsay,  Région Parisienne,  France",6,26,"Orsay,  Région Parisienne",France,
460,"Thales near  Palaiseau,  Région Parisienne,  France","Palaiseau,  Région Parisienne,  France",10,30,"Palaiseau,  Région Parisienne",France,
62,"Thales near  Paris,  Région Parisienne,  France","Paris,  Région Parisienne,  France",6,26,"Paris,  Région Parisienne",France,
71,"Thales near  Pessac,  Sud Ouest,  France","Pessac,  Sud Ouest,  France",7,19,"Pessac,  Sud Ouest",France,
63,"Thales near  Plaisir,  Région Parisienne,  France","Plaisir,  Région Parisienne,  France",8,28,"Plaisir,  Région Parisienne",France,
64,"Thales near  Puteaux,  Région Parisienne,  France","Puteaux,  Région Parisienne,  France",8,28,"Puteaux,  Région Parisienne",France,
65,"Thales near  Rambouillet,  Région Parisienne,  France","Rambouillet,  Région Parisienne,  France",12,32,"Rambouillet,  Région Parisienne",France,
34,"Thales near  Rennes,  Bretagne,  France","Rennes,  Bretagne,  France",7,18,"Rennes,  Bretagne",France,
39,"Thales near  Rouen,  France Nord,  France","Rouen,  France Nord,  France",6,20,"Rouen,  France Nord",France,
66,"Thales near  Rungis,  Région Parisienne,  France","Rungis,  Région Parisienne,  France",7,27,"Rungis,  Région Parisienne",France,
83,"Thales near  Saint Héand,  Rhône-Alpes,  France","Saint Héand,  Rhône-Alpes,  France",12,26,"Saint Héand,  Rhône-Alpes",France,
79,"Thales near  Sophia Antipolis,  PACA,  France","Sophia Antipolis,  PACA,  France",17,24,"Sophia Antipolis,  PACA",France,
76,"Thales near  Thonon,  Rhône-Alpes,  France","Thonon,  Rhône-Alpes,  France",7,21,"Thonon,  Rhône-Alpes",France,
80,"Thales near  Toulon,  PACA,  France","Toulon,  PACA,  France",7,14,"Toulon,  PACA",France,
72,"Thales near  Toulouse,  Sud Ouest,  France","Toulouse,  Sud Ouest,  France",9,21,"Toulouse,  Sud Ouest",France,
77,"Thales near  Valence,  Rhône-Alpes,  France","Valence,  Rhône-Alpes,  France",8,22,"Valence,  Rhône-Alpes",France,
67,"Thales near  Vélizy,  Région Parisienne,  France","Vélizy,  Région Parisienne,  France",7,27,"Vélizy,  Région Parisienne",France,
38,"Thales near  Vendôme,  Centre,  France","Vendôme,  Centre,  France",8,17,"Vendôme,  Centre",France,
604,"Thales near  Nieuw Muckleneuk, Pretoria,  Gauteng,  South Africa","Nieuw Muckleneuk, Pretoria,  Gauteng,  South Africa",17,27,"Nieuw Muckleneuk, Pretoria","Gauteng, South Africa",
399,"Thales near  Arnstadt,  Thüringen,  Germany","Arnstadt,  Thüringen,  Germany",9,21,"Arnstadt,  Thüringen",Germany,
122,"Thales near  Bad Hersfeld,  Hessen,  Germany","Bad Hersfeld,  Hessen,  Germany",13,22,"Bad Hersfeld,  Hessen",Germany,
400,"Thales near  Berlin,  Berlin-Brandenburg,  Germany","Berlin,  Berlin-Brandenburg,  Germany",7,28,"Berlin,  Berlin-Brandenburg",Germany,
497,"Thales near  Berlin,  Berlin,  Germany","Berlin,  Berlin,  Germany",7,16,"Berlin,  Berlin",Germany,
394,"Thales near  Hamburg,  Hamburg,  Germany","Hamburg,  Hamburg,  Germany",8,18,"Hamburg,  Hamburg",Germany,
496,"Thales near  Ismaning,  Bayern,  Germany","Ismaning,  Bayern,  Germany",9,18,"Ismaning,  Bayern",Germany,
392,"Thales near  Kiel,  Schleswig-Holstein,  Germany","Kiel,  Schleswig-Holstein,  Germany",5,26,"Kiel,  Schleswig-Holstein",Germany,
495,"Thales near  Koblenz,  Rheinland-Pfalz,  Germany","Koblenz,  Rheinland-Pfalz,  Germany",8,26,"Koblenz,  Rheinland-Pfalz",Germany,
415,"Thales near  Korntal-Münchingen,  Baden-Württemberg,  Germany","Korntal-Münchingen,  Baden-Württemberg,  Germany",19,39,"Korntal-Münchingen,  Baden-Württemberg",Germany,
121,"Thales near  Langen,  Hessen,  Germany","Langen,  Hessen,  Germany",7,16,"Langen,  Hessen",Germany,
403,"Thales near  Leipzig,  Sachsen,  Germany","Leipzig,  Sachsen,  Germany",8,18,"Leipzig,  Sachsen",Germany,
401,"Thales near  München,  Ismaning,  Germany","München,  Ismaning,  Germany",8,19,"München,  Ismaning",Germany,
404,"Thales near  Nürnberg,  Bayern,  Germany","Nürnberg,  Bayern,  Germany",9,18,"Nürnberg,  Bayern",Germany,
234,"Thales near  Pforzheim,  Baden-Württemberg,  Germany","Pforzheim,  Baden-Württemberg,  Germany",10,30,"Pforzheim,  Baden-Württemberg",Germany,
405,"Thales near  Rostock,  Mecklenburg-Vorpommern,  Germany","Rostock,  Mecklenburg-Vorpommern,  Germany",8,33,"Rostock,  Mecklenburg-Vorpommern",Germany,
396,"Thales near  Siegburg,  Nordrhein-Westfalen,  Germany","Siegburg,  Nordrhein-Westfalen,  Germany",9,31,"Siegburg,  Nordrhein-Westfalen",Germany,
126,"Thales near  Stuttgart,  Baden-Württemberg,  Germany","Stuttgart,  Baden-Württemberg,  Germany",10,30,"Stuttgart,  Baden-Württemberg",Germany,
245,"Thales near  Ulm,  Baden-Württemberg,  Germany","Ulm,  Baden-Württemberg,  Germany",4,24,"Ulm,  Baden-Württemberg",Germany,
402,"Thales near  Walldorf,  Hessen,  Germany","Walldorf,  Hessen,  Germany",9,18,"Walldorf,  Hessen",Germany,
395,"Thales near  Wilhelmshaven,  Niedersachsen,  Germany","Wilhelmshaven,  Niedersachsen,  Germany",14,30,"Wilhelmshaven,  Niedersachsen",Germany,
191,"Thales near  Koropi-Athens,  Attica,  Greece","Koropi-Athens,  Attica,  Greece",14,23,"Koropi-Athens,  Attica",Greece,
516,"Thales near  Budapest,  Budapest,  Hungary","Budapest,  Budapest,  Hungary",9,20,"Budapest,  Budapest",Hungary,
674,"Thales near  Bangalore,  Karnataka,  India","Bangalore,  Karnataka,  India",10,22,"Bangalore,  Karnataka",India,
607,"Thales near  Chennai,  Tamilnadu,  India","Chennai,  Tamilnadu,  India",8,20,"Chennai,  Tamilnadu",India,
609,"Thales near  Kochi,  Kerala,  India","Kochi,  Kerala,  India",6,15,"Kochi,  Kerala",India,
196,"Thales near  Mumbai,  Maharashtra,  India","Mumbai,  Maharashtra,  India",7,21,"Mumbai,  Maharashtra",India,
194,"Thales near  New Delhi,  Territory of Delhi,  India","New Delhi,  Territory of Delhi,  India",10,31,"New Delhi,  Territory of Delhi",India,
199,"Thales near  Jakarta,  Territory of Jakarta,  Indonesia","Jakarta,  Territory of Jakarta,  Indonesia",8,31,"Jakarta,  Territory of Jakarta",Indonesia,
202,"Thales near  Tehran,  Tehran,  Iran","Tehran,  Tehran,  Iran",7,16,"Tehran,  Tehran",Iran,
419,"Thales near  Campi Bisenzio (FI),  Toscana,  Italy","Campi Bisenzio (FI),  Toscana,  Italy",20,30,"Campi Bisenzio (FI),  Toscana",Italy,
228,"Thales near  Chieti,  Abruzzo,  Italy","Chieti,  Abruzzo,  Italy",7,17,"Chieti,  Abruzzo",Italy,
433,"Thales near  Firenze,  Toscana,  Italy","Firenze,  Toscana,  Italy",8,18,"Firenze,  Toscana",Italy,
431,"Thales near  Gorgonzola ,  Lombardia,  Italy","Gorgonzola ,  Lombardia,  Italy",12,24,"Gorgonzola ,  Lombardia",Italy,
416,"Thales near  L'Aquila,  Abruzzo,  Italy","L'Aquila,  Abruzzo,  Italy",9,19,"L'Aquila,  Abruzzo",Italy,
230,"Thales near  Milano,  Lombardia,  Italy","Milano,  Lombardia,  Italy",7,19,"Milano,  Lombardia",Italy,
205,"Thales near  Rome,  Latium,  Italy","Rome,  Latium,  Italy",5,14,"Rome,  Latium",Italy,
417,"Thales near  Torino,  Piemonte,  Italy","Torino,  Piemonte,  Italy",7,18,"Torino,  Piemonte",Italy,
432,"Thales near  Vanzago,  Lombardia,  Italy","Vanzago,  Lombardia,  Italy",8,20,"Vanzago,  Lombardia",Italy,
434,"Thales near  Vergiate,  Lombardia,  Italy","Vergiate,  Lombardia,  Italy",9,21,"Vergiate,  Lombardia",Italy,
418,"Thales near  Vimodrone (MI),  Lombardia,  Italy","Vimodrone (MI),  Lombardia,  Italy",15,27,"Vimodrone (MI),  Lombardia",Italy,
208,"Thales near  Tokyo,  Tokyo,  Japan","Tokyo,  Tokyo,  Japan",6,14,"Tokyo,  Tokyo",Japan,
136,"Thales near  Safat,  Kuwait,  Kuwait","Safat,  Kuwait,  Kuwait",6,15,"Safat,  Kuwait",Kuwait,
210,"Thales near  Beirut,  Lebanon,  Lebanon","Beirut,  Lebanon,  Lebanon",7,17,"Beirut,  Lebanon",Lebanon,
214,"Thales near  Tripoli,  Lybia,  Libya","Tripoli,  Lybia,  Libya",8,16,"Tripoli,  Lybia",Libya,
216,"Thales near  Kuala Lumpur,  Kuala Lumpur,  Malaysia","Kuala Lumpur,  Kuala Lumpur,  Malaysia",13,28,"Kuala Lumpur,  Kuala Lumpur",Malaysia,
220,"Thales near  Rabat,  Rabat-Sale-Zemmour-Zaer,  Morocco","Rabat,  Rabat-Sale-Zemmour-Zaer,  Morocco",6,32,"Rabat,  Rabat-Sale-Zemmour-Zaer",Morocco,
425,"Thales near  Delft,  Zuid-Holland,  Netherlands","Delft,  Zuid-Holland,  Netherlands",6,21,"Delft,  Zuid-Holland",Netherlands,
